{
  "schema_version": 1,
  "provider": "microsoft",
  "display_name": "Microsoft 365",
  "wave": 1,
  "verified_on": "2026-09-15",
  "public_ingress_by_context": {
    "hosted": "available",
    "self_managed": "conditional",
    "desktop": "unavailable",
    "headless": "unavailable"
  },
  "decision_records": [
    "decisions/delivery-semantics.md",
    "decisions/process-model.md",
    "decisions/self-managed-ingress.md"
  ],
  "sources": {
    "graph-calendar-delta": {
      "url": "https://learn.microsoft.com/en-us/graph/api/event-delta?view=graph-rest-1.0",
      "title": "Microsoft Graph v1.0: event delta in calendarView",
      "kind": "provider_docs",
      "verified_on": "2026-09-15",
      "notes": "The v1.0 endpoint is /me/calendarView/delta with required startDateTime and endDateTime on the initial request. Subsequent pages use the returned nextLink or deltaLink. The date window is part of the synchronization scope."
    },
    "graph-change-notifications": {
      "url": "https://learn.microsoft.com/en-us/graph/change-notifications-overview",
      "title": "Microsoft Graph: Change notifications overview",
      "kind": "provider_docs",
      "verified_on": "2026-09-05",
      "notes": "An app subscribes to a resource and Microsoft Graph POSTs notifications to notificationUrl. Notifications are thin by default (resource, resourceData with id, @odata.type and @odata.id, changeType, subscriptionId, subscriptionExpirationDateTime, clientState, tenantId) and the app fetches the changed item itself. Subscriptions expire and must be renewed by PATCHing the subscription before subscriptionExpirationDateTime. Notifications can arrive out of order and can be duplicated."
    },
    "graph-webhook-delivery": {
      "url": "https://learn.microsoft.com/en-us/graph/change-notifications-delivery-webhooks",
      "title": "Microsoft Graph: Change notification delivery through webhooks",
      "kind": "provider_docs",
      "verified_on": "2026-09-15",
      "notes": "Subscription creation triggers a validation request: Graph POSTs to notificationUrl with a validationToken query parameter, and the endpoint must echo the decoded token as text/plain with HTTP 200 within 10 seconds or the subscription is not created. Notifications must be answered with 2xx within three seconds; Graph retries an unanswered or failed notification with a backoff for roughly four hours before dropping it. clientState, supplied at subscription creation, is echoed in every notification and is the value the receiver compares."
    },
    "graph-subscription": {
      "url": "https://learn.microsoft.com/en-us/graph/api/resources/subscription",
      "title": "Microsoft Graph: subscription resource type",
      "kind": "provider_docs",
      "verified_on": "2026-09-15",
      "notes": "Maximum subscription lifetimes are per resource; Outlook message, event and contact resources are documented at 10,080 minutes (seven days), and drive resources differ between OneDrive personal and OneDrive for Business or SharePoint. lifecycleNotificationUrl must be supplied at creation to receive lifecycle events. expirationDateTime is required and renewal is a PATCH of that property."
    },
    "graph-lifecycle-events": {
      "url": "https://learn.microsoft.com/en-us/graph/change-notifications-lifecycle-events",
      "title": "Microsoft Graph: Lifecycle notifications",
      "kind": "provider_docs",
      "verified_on": "2026-09-05",
      "notes": "Three lifecycle event types are delivered to lifecycleNotificationUrl: subscriptionRemoved (the subscription is gone and must be recreated), missed (notifications could not be delivered and the app must resync, typically with a delta query), and reauthorizationRequired (the subscription needs its authorization refreshed). Lifecycle notifications are themselves validated with the same validationToken handshake."
    },
    "graph-delta-query": {
      "url": "https://learn.microsoft.com/en-us/graph/delta-query-overview",
      "title": "Microsoft Graph: Use delta query to track changes",
      "kind": "provider_docs",
      "verified_on": "2026-09-05",
      "notes": "A delta function call returns changed items plus an @odata.deltaLink to use on the next round; the call is an ordinary outbound HTTPS request with the user's delegated token. A deltaLink that is no longer usable returns HTTP 410 Gone with the error code syncStateNotFound, and the caller must restart the enumeration from scratch. Delta is supported for mail folder messages, calendar events, and driveItem changes."
    },
    "graph-throttling": {
      "url": "https://learn.microsoft.com/en-us/graph/throttling",
      "title": "Microsoft Graph: Throttling guidance and service limits",
      "kind": "provider_docs",
      "verified_on": "2026-09-05",
      "notes": "Graph returns HTTP 429 with a Retry-After header when a service limit is exceeded. Outlook service limits are documented per mailbox per app (10,000 requests per 10 minutes) and are shared by every app acting on that mailbox, so a poll loop and a fetch-back path compete for the same budget."
    },
    "graph-teams-licenses": {
      "url": "https://learn.microsoft.com/en-us/graph/teams-licenses",
      "title": "Microsoft Graph: Licensing and payment requirements for Microsoft Teams APIs",
      "kind": "provider_docs",
      "verified_on": "2026-09-10",
      "notes": "The listed Teams APIs stopped being metered on 2025-08-25; billing configuration and the model query parameter are no longer required. The historical model A/model B requirements do not justify excluding Teams message notifications. Resource-specific permission requirements are recorded in graph-teams-notifications."
    },
    "graph-teams-notifications": {
      "url": "https://learn.microsoft.com/en-us/graph/teams-changenotifications-chatmessage",
      "title": "Microsoft Graph: Change notifications for Teams channel and chat messages",
      "kind": "provider_docs",
      "verified_on": "2026-09-10",
      "notes": "Tenant-wide /teams/getAllMessages and /chats/getAllMessages subscriptions require application permissions. Individual channel subscriptions support delegated ChannelMessage.Read.All; individual chat subscriptions support delegated Chat.Read. Teams cannot be ruled out categorically on delegated-permission grounds."
    },
    "graph-resource-data": {
      "url": "https://learn.microsoft.com/en-us/graph/change-notifications-with-resource-data",
      "title": "Microsoft Graph: Change notifications with resource data",
      "kind": "provider_docs",
      "verified_on": "2026-09-10",
      "notes": "Rich notifications include the changed resource inline, encrypted with a public key the subscriber supplies at creation (includeResourceData, encryptionCertificate, encryptionCertificateId); the subscriber holds the private key and decrypts each notification. Only a subset of resources supports it."
    }
  },
  "open_questions": [
    "Maximum subscription lifetimes are documented per resource and differ between OneDrive personal, OneDrive for Business and SharePoint drives; the renewal job must read subscriptionExpirationDateTime from the created subscription rather than assume one number. The hosted-app owner re-verifies the per-resource ceilings before GA.",
    "Microsoft Graph does not sign notifications; clientState is a shared secret echoed in the body. The gate accepts it because TRG-4 also enforces an opaque per-trigger ingress path and a body cap, but the security review (TRG-8) has to agree."
  ],
  "mechanisms": [
    {
      "mechanism_id": "microsoft.graph_change_notifications",
      "display_name": "Microsoft Graph change notifications (webhook)",
      "track": "a",
      "transport": "http_push",
      "ingress_requirement": "public_https",
      "deployment_contexts": ["hosted", "self_managed"],
      "fallback_mechanism": "microsoft.graph_delta_poll",
      "status": "wave_1",
      "confidence": "medium",
      "owning_ticket": "TRG-6",
      "rationale": "The only push delivery Graph offers for mail, calendar and drive items, and the mechanism the deferred record named as the Microsoft candidate. TRG-4 owns the handshake, the clientState check and the lifecycle route; TRG-6 owns the subscription provider and the fetch-back.",
      "events": [
        "me/mailFolders('Inbox')/messages created",
        "me/events created and updated",
        "me/drive/root changed (driveItem)",
        "sites/{site-id}/drive/root changed (driveItem)"
      ],
      "required_scopes": ["Mail.Read", "Calendars.Read", "Files.Read", "Files.Read.All", "Sites.Read.All"],
      "inbound_auth": {
        "method": "validation_token",
        "details": "Two checks, neither of them a signature. At creation Graph POSTs a validationToken query parameter that the route echoes as text/plain with 200 within ten seconds, before any database write. On every later notification the receiver compares the echoed clientState against the value stored on the subscription row in constant time, and the trigger is addressed by an opaque per-trigger ingress id so an unknown id costs the same as a bad clientState.",
        "source": "graph-webhook-delivery"
      },
      "subscription": {
        "required": true,
        "max_ttl_seconds": null,
        "renewal": "Primeagent creates the subscription with an expirationDateTime and a lifecycleNotificationUrl, then renews by PATCHing expirationDateTime ahead of the value Graph returned; the renewal job keys off the stored subscriptionExpirationDateTime rather than a constant, because the ceiling differs per resource (10,080 minutes for Outlook message, event and contact resources). subscriptionRemoved recreates the subscription, missed forces a delta resync, and reauthorizationRequired queues an immediate PATCH renewal that also reauthorizes the subscription. A confirmed unusable connection moves the trigger to needs_reconnect.",
        "source": "graph-subscription"